{
  "completeness": {
    "counters": [
      {
        "kind": "loss",
        "name": "count.map_insert_dropped",
        "source": "kernel-map",
        "units": "events",
        "value": 0
      }
    ],
    "fatal_kind": null,
    "reasons": [],
    "status": "COMPLETE"
  },
  "coverage": [
    {
      "attached": 1,
      "discovered": 1,
      "expected": {
        "sites": 1,
        "state": "applicable"
      },
      "scope": "provider/default"
    }
  ],
  "disposition": {
    "code": 0,
    "outcome": "exited",
    "pid": null
  },
  "fenced": [
    {
      "generation": 1,
      "sites": [
        {
          "calls": 50,
          "candidates": [
            {
              "algorithm_classes": [
                "DES"
              ],
              "funcid": 21,
              "op": 2,
              "provider": "build:0123456789abcdef0123456789abcdef0123456789abcdef0123456789abcdef",
              "provider_class": "default",
              "weak_alias": false
            }
          ],
          "candidates_coverage": "complete",
          "device": 8,
          "first_ns": 10,
          "generation": 1,
          "inode": 100,
          "last_ns": 90,
          "object": "build:0123456789abcdef0123456789abcdef0123456789abcdef0123456789abcdef",
          "offset": 4096
        }
      ]
    }
  ],
  "legacy_partition": {
    "legacy_exclusive_calls": 0,
    "non_legacy_exclusive_calls": 550,
    "shared_ambiguous_calls": 0,
    "unfenced_tail_calls": 0
  },
  "objects": [
    {
      "device": 8,
      "display_locator": "/usr/lib/x86_64-linux-gnu/ossl-modules/default.so",
      "id": "build:0123456789abcdef0123456789abcdef0123456789abcdef0123456789abcdef",
      "inode": 100
    },
    {
      "device": 8,
      "display_locator": "/usr/lib/x86_64-linux-gnu/ossl-modules/legacy.so",
      "id": "build:fedcba9876543210fedcba9876543210fedcba9876543210fedcba9876543210",
      "inode": 200
    },
    {
      "device": 8,
      "display_locator": "/opt/vendor/lib/third-party.so",
      "id": "unverified:8:123456",
      "inode": 300
    }
  ],
  "openssl": {
    "state": "verified",
    "version": "3.5.1"
  },
  "policy": {
    "rules": [
      {
        "definite": 550,
        "evidence": [
          {
            "calls": 500,
            "device": 8,
            "generation": 0,
            "inode": 100,
            "object": "build:0123456789abcdef0123456789abcdef0123456789abcdef0123456789abcdef",
            "offset": 4096
          },
          {
            "calls": 50,
            "device": 8,
            "generation": 1,
            "inode": 100,
            "object": "build:0123456789abcdef0123456789abcdef0123456789abcdef0123456789abcdef",
            "offset": 4096
          }
        ],
        "possible": 550,
        "predicate": "algorithm=DES",
        "result": "violation",
        "rule": "deny-algorithm"
      },
      {
        "definite": 0,
        "evidence": [],
        "possible": 0,
        "predicate": "weak-alias",
        "result": "pass",
        "rule": "deny-weak"
      }
    ],
    "verdict": "violation"
  },
  "schema_version": "observed-crypto-v2.1",
  "sites": [
    {
      "calls": 500,
      "candidates": [
        {
          "algorithm_classes": [
            "DES"
          ],
          "funcid": 21,
          "op": 2,
          "provider": "build:0123456789abcdef0123456789abcdef0123456789abcdef0123456789abcdef",
          "provider_class": "default",
          "weak_alias": false
        }
      ],
      "candidates_coverage": "complete",
      "device": 8,
      "first_ns": 10,
      "generation": 0,
      "inode": 100,
      "last_ns": 90,
      "object": "build:0123456789abcdef0123456789abcdef0123456789abcdef0123456789abcdef",
      "offset": 4096
    }
  ],
  "target": {
    "argv_redacted": true,
    "comm": "demo",
    "container_id": "",
    "image_digest": "",
    "pid": 7
  },
  "window": {
    "effective_end_ns": 100,
    "effective_start_ns": 0,
    "requested_end_ns": 100,
    "requested_start_ns": 0,
    "signal_cut": false
  }
}
