{
  "completeness": {
    "counters": [
      {
        "kind": "loss",
        "name": "count.map_insert_dropped",
        "source": "kernel-ring",
        "units": "events",
        "value": 3
      }
    ],
    "fatal_kind": null,
    "reasons": [
      {
        "kind": "undiscovered-sites",
        "missing": 1,
        "scope": "provider/default"
      },
      {
        "kind": "unattached-sites",
        "missing": 2,
        "scope": "provider/default"
      },
      {
        "counter": "count.map_insert_dropped",
        "kind": "loss",
        "source": "kernel-ring",
        "value": 3
      },
      {
        "calls": 50,
        "kind": "unattributed-calls",
        "sites": 1
      },
      {
        "kind": "startup-gap",
        "missing_ns": 5
      },
      {
        "kind": "tail-gap",
        "missing_ns": 5
      }
    ],
    "status": "PARTIAL"
  },
  "context": {
    "kernel_release": "6.9.0-test",
    "wall_end_unix_ns": 1700000030000000000,
    "wall_start_unix_ns": 1700000000000000000
  },
  "coverage": [
    {
      "attached": 1,
      "discovered": 2,
      "expected": {
        "sites": 3,
        "state": "applicable"
      },
      "scope": "provider/default"
    }
  ],
  "disposition": {
    "code": null,
    "outcome": "detached-running",
    "pid": 9
  },
  "fenced": [],
  "legacy_partition": {
    "legacy_exclusive_calls": 0,
    "non_legacy_exclusive_calls": 250,
    "shared_ambiguous_calls": 0,
    "unfenced_tail_calls": 0
  },
  "objects": [
    {
      "device": 8,
      "display_locator": "/usr/lib/x86_64-linux-gnu/ossl-modules/default.so",
      "id": "build:0123456789abcdef0123456789abcdef0123456789abcdef0123456789abcdef",
      "inode": 100
    },
    {
      "device": 8,
      "display_locator": "/usr/lib/x86_64-linux-gnu/ossl-modules/legacy.so",
      "id": "build:fedcba9876543210fedcba9876543210fedcba9876543210fedcba9876543210",
      "inode": 200
    },
    {
      "device": 8,
      "display_locator": "/opt/vendor/lib/third-party.so",
      "id": "unverified:8:123456",
      "inode": 300
    }
  ],
  "openssl": {
    "state": "unknown",
    "version": null
  },
  "schema_version": "observed-crypto-v2.1",
  "sites": [
    {
      "calls": 200,
      "candidates": [
        {
          "algorithm_classes": [
            "AES-128-GCM"
          ],
          "funcid": 21,
          "op": 2,
          "provider": "build:0123456789abcdef0123456789abcdef0123456789abcdef0123456789abcdef",
          "provider_class": "default",
          "weak_alias": false
        }
      ],
      "candidates_coverage": "complete",
      "device": 8,
      "first_ns": 10,
      "generation": 0,
      "inode": 100,
      "last_ns": 90,
      "object": "build:0123456789abcdef0123456789abcdef0123456789abcdef0123456789abcdef",
      "offset": 4096
    },
    {
      "calls": 50,
      "candidates": [
        {
          "algorithm_classes": [
            "SHA-256"
          ],
          "funcid": 7,
          "op": 1,
          "provider": "build:fedcba9876543210fedcba9876543210fedcba9876543210fedcba9876543210",
          "provider_class": "default",
          "weak_alias": false
        }
      ],
      "candidates_coverage": "unknown",
      "device": 8,
      "first_ns": 10,
      "generation": 0,
      "inode": 200,
      "last_ns": 90,
      "object": "build:fedcba9876543210fedcba9876543210fedcba9876543210fedcba9876543210",
      "offset": 16384
    }
  ],
  "target": {
    "argv_redacted": true,
    "comm": "staging",
    "container_id": "cid-1",
    "image_digest": "sha256:abc",
    "pid": 9
  },
  "window": {
    "effective_end_ns": 95,
    "effective_start_ns": 5,
    "requested_end_ns": 100,
    "requested_start_ns": 0,
    "signal_cut": false
  }
}
